"idx","comment_id","author","created_utc","aspects","sentiments","scores","body"
"65","ellyvjt","andrewdrewandy","1556058084","Jobs-Housing Imbalance | Responsibility Attribution | Tax Structure And Public Finance","positive | negative | positive","1.0 | -1.0 | 1.0","&gt;level 3tghettoOriginal Poster7 points · 2 hours agoWell yeah, some cities do approve more business space than they do residential space. There is an incentive for it, financially speaking, because businesses bring a bigger revenue to the city than residential units would. But when it comes to constructing residential units, it certainly doesn't help when you have NIMBY neighbors posting stuff like this trying to prevent construction from happening.ReplyGive Awardsharereport

Emeryville is a great example of this. So much sales tax, so little residents!"
"66","ellyvph","LauraPringlesWilder","1556058087","","","","I hate this so much I almost downvoted you. God, the nerve"
"67","ellyvvb","0lazy0","1556058090","","","","What is NIMBYism"
"68","ellz2pl","argote","1556058231","Neighborhood Character Preservation | Responsibility Attribution","negative | negative","-1.0 | -1.0","I'll never understand why people who own a single lot feel entitled to dictate what every lot in a one mile radius does or is used for.

Unless it was explicitly stated in a covenant when you bought your property or zoning is being drastically changed, you don't and shouldn't have any say in it."
"69","ellz4a7","andoman66","1556058264","Responsibility Attribution | Homeowner Property Values | Nextdoor Platform Quality","negative | neutral | negative","-1.0 | 0.0 | -1.0","I thought so as well, until I read through their 4 paragraph manifesto patting themselves on the back for working in tech and being able to work from home so they never left their dogs side. Some of us don't have the luxury of working from home everyday, so I moved from a top story North Beach flat to a house in the Sunset so I could have a yard for my dog. It was like a gut punch making that move and getting a complaint filed within the first week of living at my new place."
"70","ellz5il","andrewdrewandy","1556058287","","","","&gt;If you're able bodied and up to it and willing/able to part with the cash of buying your own, this is when something like one of those electric kick scooters come in handy.  I know, it's crazy we even have to buy secondary transportation to our primary transportation, but I've often thought of this as a decent workaround in low parking areas."
"71","ellzf9f","KCrobble","1556058482","Nextdoor Platform Quality","negative","-1.0","Unfortunately for me, I have a unique name, so using my actual name is tantamount to giving up my address work history etc.

While I understand their policy too, it has very different repercussions for me vs. someone named ""Michael Smith.""

Regardless, I think it is nuts to ask for my password."
"72","ellzg29","greebytime","1556058498","Racial Coding Of Opposition | Nextdoor Platform Quality","negative | negative","-1.0 | -1.0","My wife and I play a game on Nextdoor, which is ""how creative can someone be at saying they don't want minorities in the neighborhood WITHOUT actually saying that explicitly!"" 

Sadly, there are many contenders for the title."
"73","ellzgdn","crank1000","1556058505","Racial Coding Of Opposition","negative","-1.0","Lol wtf? Where does it even remotely mention race?"
"74","ellzggd","coolchewlew","1556058506","Building Height And Density | Neighborhood Character Preservation","negative | negative","-1.0 | -1.0","It's annoying but I understand the sentiment.  The house next to my gf's was torn down and was replaced by a massive multi until triplex or whatever. People now have a window looking into her skylight now.
What are you gonna do though?"
"75","ellzi0d","nailz1000","1556058537","Housing Supply Expansion | Building Height And Density","positive | positive","1.0 | 1.0","\&gt; SF is land locked. Hell, the peninsula is land locked.   


Didn't stop Manhattan, certainly."
"76","ellzknx","crank1000","1556058590","Housing Supply Expansion | Homeowner Property Values","negative | positive","-1.0 | 1.0","All the points they make are valid. It just doesn’t fit the reddit narrative that everyone should get to live in prime real-estate for project prices."
"77","ellzm00","srcarruth","1556058618","Nextdoor Platform Quality | Neighborhood Character Preservation | Responsibility Attribution","negative | neutral | neutral","-1.0 | 0.0 | 0.0","oh that battle raged hard on Facebook, too.  two different Facebook groups were at odds and it was the most infantile thing I'd seen a group of adults do in a while.  live streaming themselves screaming at one another across the street.  lots of insults and anger.  crazy stuff.  I'm glad the election is over, the site was rezoned so it can be a respite center now.  that's all the vote was, rezoning."
"78","ellzpnp","srcarruth","1556058689","","","","it did refer to 40 acres, originally, comes down from the Homestead Acts"
"79","ellzprf","nutationsf","1556058692","Homeowner Property Values","negative","-1.0","Some home owners do realize housing shortages increase the value of their property and don’t care about anyone else."
"80","ellzr2s","ImFeklhr","1556058718","","","","Same. I just let them shut my account down, and I haven't been back in the ensuing years."
"81","ellzuwv","KCrobble","1556058795","","","","I don't miss it either.  I do hope a couple of people on there have moved the eff out of my neighborhood though.  :)"
"82","ellzwwn","Ochotona_Princemps","1556058835","Tax Structure And Public Finance | Jobs-Housing Imbalance | Responsibility Attribution","positive | positive | negative","1.0 | 1.0 | -1.0","Bingo. If people want the same level of public services (especially in light of pension and healthcare costs), but also less and lower-paying employment, they are going to have to significantly raise taxes, especially property taxes.

The employment boom is the only thing keeping municipal budgets (barely) afloat."
"83","ellzwxl","Some_Pleb","1556058836","","","","If it keeps you from sleeping..."
"84","ellzxyq","trashacount12345","1556058857","Housing Supply Expansion | Neighborhood Character Preservation","negative | positive","-1.0 | 1.0","By smart growth I take it they really mean no growth."
"85","ellzycc","JeebusChrist","1556058864","Homeowner Property Values | Responsibility Attribution","negative | negative","-1.0 | -1.0","&gt; ~~Some~~ A distressing majority of Bay Area home owners do realize housing shortages increase the value of their property and don’t care about anyone else.

FTFY"
"86","elm026c","JeebusChrist","1556058943","Building Height And Density | Neighborhood Character Preservation | Parking Availability","negative | negative | negative","-1.0 | -1.0 | -1.0","This proposed building is literally FOUR TIMES LARGER than any building has any right to be! It's going to ruin our neighborhood with ~~undesirables~~ traffic!"
"87","elm02oc","trashacount12345","1556058953","Neighborhood Character Preservation | Housing Supply Expansion","negative | negative","-1.0 | -1.0","NIMBY stands for Not In My Back Yard. The classic example is saying you want wind power but then demanding that the windmills don’t block your view. Then everyone says the same thing. Then the wind power never happens."
"88","elm03yz","user_none","1556058978","Building Height And Density | Housing Supply Expansion","neutral | neutral","0.0 | 0.0","Okay, neat. This isn't Manhattan.

Care to address how higher density residential units are built without razing current homes/apartments/etc...?"
"89","elm046v","icraig91","1556058983","Homeowner Property Values | Responsibility Attribution | Nextdoor Platform Quality","neutral | negative | negative","0.0 | -1.0 | -1.0","Must be so nice they can do that. I'm in tech, but I can't WFH. I'm sure they'd consider me cruel for having my dog cooped up inside all day while I'm at my office.. Sorry you've gotta live near that bullshit; It's clear you take care of your pup. Those guys are a buncha dicks."
"90","elm052u","0lazy0","1556059001","","","","Ohh ya I’ve heard of that. Thanks for reminding me and great explanation"
"91","elm05n6","compstomper","1556059013","","","","The entire Bay area is doing this"
"92","elm07ig","CarjackHorseman","1556059050","Racial Coding Of Opposition","neutral","0.0","I remember seeing a sign in Tracy that said something about how a new affordable housing development in our city would cause a drastic increase in the crime rate.  I can't for sure say that was explicitly racist, but I also can't confidently say that it wasn't."
"93","elm08dr","compstomper","1556059068","","","","The 40 year old tech fad?"
"94","elm0ffb","CarjackHorseman","1556059212","","","","Not In My Back Yard!"
"95","elm0oiq","jsalsman","1556059397","","","","I blame their failure to make a custom-named bit.ly link."
"96","elm0pzw","andoman66","1556059427","Neighborhood Character Preservation","positive","1.0","I agree. I have since moved across SF and have a similar place with a yard. Now my neighbors text me when they haven't seen my dog playing in the backyard if I take him out of town. My neighbor who's yard backs up to mine loves watching my dog play around while she is working around her house. Total opposite response from my new neighbors. Some people suck."
"97","elm0t86","dave5104","1556059493","Jobs-Housing Imbalance | Transit Proximity","negative | negative","-1.0 | -1.0","That's not *entirely* true. San Jose is infamously a bedroom community, having more housing than jobs. Latest article I could find stating this is from March 2017, but I'm not sure it has reversed:

&gt; We are the only major city in the country that has a smaller daytime population than nighttime population. Cities are typically job centers but in San Jose we are a bedroom community with incredible job centers around us. Many of our employers tend to be on our doorstep, not inside the house.

This is also a huge reason why traffic sucks. People need to travel on highways to other cities to get to their job, instead of being able to stay on roads within their own city limits to get to their job."
"98","elm121s","jrhoffa","1556059678","","","","I'm convinced that these people never sleep and live outside."
"99","elm19zm","Jollz3000","1556059838","Housing Supply Expansion | Homeowner Property Values | Responsibility Attribution","negative | negative | negative","-1.0 | -1.0 | -1.0","It stands for Not In My Back Yard and relates for the most part to older homeowners whom seek to stifle development either of dislike for change or personal gain through driving property values up."
"100","elm1c8x","illuzion25","1556059882","Racial Coding Of Opposition | Nextdoor Platform Quality","positive | negative","1.0 | -1.0","Are you suggesting there's latent racism on nextdoor? I mean, I know for my neighborhood it's always either a lost wallet or, ""a suspicious looking dark skinned gentleman between the ages of 16 and 65, approximately 5 foot 2 to 6 foot 7. He might also be wearing pants.""

That's gotta just be my neighborhood, right?"
"101","elm1hvo","send_fooodz","1556059998","","","","What a waste of resources.

I got into a mini argument with someone who called 911 on a vehicle that parked in front of their house during a street sweeping day. They were upset that they were ticketed in the past, AND that the road in front of their house went unswept for the week. Of course the police never showed up, but that didn't stop them from following up with 911 a few more times until the vehicle finally left."
"102","elm1ibh","llama-lime","1556060007","Responsibility Attribution | Housing Supply Expansion","negative | positive","-1.0 | 1.0","&gt; Everyone wants to add more housing.

No, not everyone. In particular, those who have the power to limit housing are the ones who do not want to add housing. They do not represent the people who actually work and live here, though."
"103","elm1itx","KCrobble","1556060018","","","","I moved to the SW from the Sunset too.  Couldn't be happier."
"104","elm1mr7","nailz1000","1556060100","Housing Supply Expansion | Building Height And Density | Transit Proximity","positive | positive | neutral","1.0 | 1.0 | 0.0","Seems like Seattle has it figured out. Also seems like if you take either an empty lot or a nearly vacant low rise, and replace it with a high density condo unit and move displaced families back in afterwards with possible temporary government rent subsidies, it's entirely feasible. It's not like it's impossible to build new large buildings in San Francisco.

I MEAN MAYBE I'M CRAZY BUT IT SURE LOOKS LIKE SALESFORCE JUST ERECTED A GAINT 50 FLOOR TOWER DOWNTOWN.  


Further: your argument was that SF is landlocked. That's obviously not a unique situation, nor a problem for other places."
"105","elm1ru4","I_DONT_READ_ANYTHING","1556060202","","","","I just want to live in a beautiful place out in the countryside in downtown SF."
"106","elm1zr3","regul","1556060366","Building Height And Density | Neighborhood Character Preservation | Jobs-Housing Imbalance","neutral | neutral | negative","0.0 | 0.0 | -1.0","South City is like the poster child for this. Oyster Point is almost nothing but giant office buildings and the rest of South City is ranch houses and 4-unit apartment buildings."
"107","elm2iap","regul","1556060740","Parking Availability | Transit Proximity | Housing Supply Expansion","positive | positive | positive","1.0 | 1.0 | 1.0","It's a ten minute walk to a Bart station with a proposed 1.25 parking spaces per unit. Eventually as a society we have to realize that not everyone is going to be entitled to one car per family member. And if you're going to build something with ""reduced"" parking (still &gt; 1 space per unit, so ""reduced"" is a strong word), where else than right next to frequent rapid transit?"
"108","elm36px","ikiller","1556061240","Jobs-Housing Imbalance | Tax Structure And Public Finance | Housing Supply Expansion","negative | neutral | neutral","-1.0 | 0.0 | 0.0","I never said it started in 2010, that's just span I know a statistic for.  The fact that it started earlier and the leaders still allowed the 8:1 jobs to housing ratio happen makes their actions worse.  

There was a ton of development in the seventies that really built out in all the easy areas.  It makes sense that housing naturally slowed down in the eighties after the low hanging developments got built then the economy tanked.

Prop 13 was passed democratically, and it shows that at the time people's biggest fear was being priced out of their community (right around when there was a ton of development).  Now everybody is all upset and exited about this housing ”crisis"" and you can expect a bunch more well meaning but poorly drafted ""solutions"".  Fear and emotions make a bad basis for legislation.

There are many factors that have led to the lack of housing growth outside of prop 13.  Basically it just doesn't pencil out for developers. Land is expensive, there will never be a lack of people who want to live somewhere so beautiful, construction is expensive, most land is either protected open space or already housing people who don't want to move, and then on top of it all you now have a bunch of rich entitled transplants who spent a lot of money to live where they live because they like it the way it is.

So according to you, we have a place that due to many external and internal factors, has proven to be difficult and expensive to increase housing in for the past 40 years.  Doesn't that seen like a really bad place to put a shit ton of new jobs?  CEOs can't just invade a place and wave a magic wand and change all the market fundamentals and politics.  Wouldn't it be better to stop subsidizing the egos of CEOs and instead make them actually innovate?"
"109","elm3l7b","Ploddit","1556061537","Building Height And Density | Neighborhood Character Preservation | Homeowner Property Values","negative | negative | negative","-1.0 | -1.0 | -1.0","Eight stories is a high rise?

Do those people know there are places you can move to called ""suburbs""? I think they'd be happier. Seems easier than trying to pretend they don't live in a city."
"110","elm3lqv","You-need-a-big-one","1556061548","","","","Same. Or to find odd jobs for extra cash."
"111","elm40wq","audi100quattro","1556061858","Nextdoor Platform Quality","negative","-1.0","nimbyden would be an on-brand name change for nextdoor."
"112","elm45nn","ikiller","1556061953","Tax Structure And Public Finance | Jobs-Housing Imbalance | Housing Supply Expansion","negative | negative | negative","-1.0 | -1.0 | -1.0","It was actually during the economic booms that the most egregious and unsustainable pension enhancements were enacted.  The real problem is the concentration of high paying jobs.  

If you follow the anti-prop 13 and pro density/TOD movements to their logical conclusions, the region would  solely consist of the super rich landed class in single family housing, and their low class service workers in subsidized high density housing, with everybody else commuting in.  Doesn't sound healthy and vibrant to me.  For true upward mobility you need to have a viable middle class present.

  With the current reality, prop 13 is the only reason there is any middle class still hanging on around here.  Please fully tax the commercial properties and second homes though."
"113","elm4cgg","ikiller","1556062091","Responsibility Attribution | Jobs-Housing Imbalance","negative | negative","-1.0 | -1.0","We'll the tech CEOs want housing built for their workers, but just not near them.  They want the them all to live about forty five minutes away."
"114","elm4lk9","Commentariot","1556062273","Homeowner Property Values | Housing Supply Expansion","negative | positive","-1.0 | 1.0","Bullshit. I have never met a single home owner with this opinion. I live on a block of single family homes and everyone I have spoken to here has, for decades, been pro more housing. We have fucking kids. Where do they get to live?"
"115","elm4ok0","cdford","1556062334","","","","I dunno just today I saw a crazy old man in on there ranting about how the police are a satanic freemason cult. Apparently the whole ""black and white"" thing comes from the fact they believe in doing good AND evil to balance things out."
"116","elm4vmt","Qbugger","1556062481","Neighborhood Character Preservation | Building Height And Density","negative | negative","-1.0 | -1.0","Have you herd a train horn? thanks to new developments there are an increase of trains.. every time the train goes pass a road it must blow that damn horn 10 pm, 1230 am, 3 am 5 am. Worse than a plane.. trust me."
"117","elm4y8w","holomntn","1556062536","","","","Barely Literate Wingnuts, Inc"
"118","elm4zum","SanFranRules","1556062570","Jobs-Housing Imbalance | Responsibility Attribution","positive | negative","1.0 | -1.0","You don't think Peninsula cities allowing businesses to build offices for tens of thousands of employees while not building housing caused a problem? I get that it's a chicken or the egg kind of problem, but businesses deciding to build huge offices in heavily impacted housing markets absolutely played a role in this."
"119","elm5ayu","JeebusChrist","1556062790","Housing Supply Expansion | Responsibility Attribution | Nextdoor Platform Quality","positive | negative | neutral","1.0 | -1.0 | 0.0","Look no further than the battles against development across [Silicon Valley](https://www.vox.com/2015/2/25/8109437/how-nimbyism-is-holding-back-silicon-valley-and-the-american-economy), [the North Bay](https://medium.com/@abrahamwoodliff/the-bay-areas-housing-crisis-could-be-solved-by-developing-marin-county-5034474c5009), and [the Peninsula](https://nextcity.org/daily/entry/palo-alto-one-ups-san-francisco-rejects-senior-housing-complex-in-citywide-).

I have had similar experiences but I live in the 'burbs in Vallejo, and my experiences are not universal."
"120","elm5yrg","jrhoffa","1556063264","","","","I live a block from a major train crossing.  I don't even notice any more."
"121","elm5yzw","fried_green_baloney","1556063269","","","","My favorites - pictures of unusual cloud formations with titles like ""What is going on here?"" and comments of the ""May I please speak to the manager?"" tone."
"122","elm6132","fried_green_baloney","1556063310","Building Height And Density | Neighborhood Character Preservation | Homeowner Property Values","negative | negative | negative","-1.0 | -1.0 | -1.0","Where distressing is taken to mean 99.9%.

Even tempered friend got red in the face and pounded tables at the thought of apartments three blocks from his home."
"123","elm6ljn","Oakroscoe","1556063709","Building Height And Density | Transit Proximity","negative | negative","-1.0 | -1.0","It took a year for me to get used to BART and not wake up when it went by and I had the window open, I’d hate to think how long it would take for a train horn."
"124","elm6mgv","MrAkai","1556063727","Racial Coding Of Opposition | Neighborhood Character Preservation | Transit Proximity","positive | negative | neutral","1.0 | -1.0 | 0.0","I live in a pretty diverse neighborhood so I don't see too much ""POC ALERT"" type stuff, but holy shit did the people in the nearby mostly-white neighborhood loose their shit when Habitat for Humanity wanted to develop a parcel of land that's been empty for years (and under BART tracks so not exactly likely to attract high-end investment)."
"125","elm6miv","FlyingPhotog","1556063728","Nextdoor Platform Quality | Neighborhood Character Preservation | Racial Coding Of Opposition","negative | negative | negative","-1.0 | -1.0 | -1.0","I requested they permanently delete my account two days ago.

It's shocking just how many people stare out their windows waiting to complain about anything. People who are shockingly paranoid and scared about everything around them... and deathly terrified of change.

It brings out the racists in the area. It brings out the government haters, too.

I simply can't believe what a cesspool it is. Worse than Facebook in many ways."
"126","elm6vtd","youandmeboth","1556063913","","","","I moved to Rockridge recently and you just inspired me to make an account"
"127","elm726q","cutearmy","1556064042","Responsibility Attribution | Homeowner Property Values","negative | negative","-1.0 | -1.0","The whole area is neoliberal heaven. My area of the bay voted down free housing for disabled veterans because it will drive down their home prices."
"128","elm754j","fried_green_baloney","1556064104","","","","Every time landing paths to SFO are realigned, some area is sure to complain.  Like planes shouldn't be allowed to fly over Woodside."
"129","elm7dxj","FlyingPhotog","1556064281","","",""," [https://hbr.org/2018/05/how-nextdoor-addressed-racial-profiling-on-its-platform](https://hbr.org/2018/05/how-nextdoor-addressed-racial-profiling-on-its-platform)"
"130","elm7e0s","jrhoffa","1556064283","Transit Proximity | Neighborhood Character Preservation","negative | negative","-1.0 | -1.0","Zero days, because I don't live on the fucking moon and have already adjusted to the sounds of modern civilization.

BART sounds would probably drive me nuts, though.  Like a banshee."
"131","elm7fgt","krism142","1556064312","Jobs-Housing Imbalance | Responsibility Attribution","positive | negative","1.0 | -1.0","The cities have been doing everything they can to bring more jobs to the area, it's not just the CEOs"
"132","elm7g10","FlyingPhotog","1556064323","Nextdoor Platform Quality","negative","-1.0","I used it for that for a while, but the posters are more delusional than Facebook Marketplace and the volume of goods wasn't enough to warrant checking it frequently."
"133","elm7qhi","Oakroscoe","1556064535","Transit Proximity | Neighborhood Character Preservation","negative | negative","-1.0 | -1.0","It took a while for BART, but you get used to it.  The train horn would wake me up every time.  A train is like 1860 civilization, I wouldn’t exactly call it modern civilization."
"134","elm7tbj","KushloverXXL","1556064593","Neighborhood Character Preservation | Nextdoor Platform Quality","negative | negative","-1.0 | -1.0","This is such passive aggressive behavior that people get away with too much here. If they have an issue, they should come talk to you first. So much for being neighborly."
"135","elm7wfa","speedyspaghetti","1556064657","Racial Coding Of Opposition | Nextdoor Platform Quality","negative | negative","-1.0 | -1.0","We live in the Bay Area - everyone pretends to not be racist but then inserts race into every single topic even when it does not matter. I've just learned to tune out these people."
"136","elm8309","Magicbythelake","1556064791","","","","If I'm not incorrect, I believe this is regarding the city of South San Francisco, which is typically considered a suburb."
"137","elm830v","jasnooo","1556064792","Nextdoor Platform Quality | Neighborhood Character Preservation | Racial Coding Of Opposition","negative | negative | negative","-1.0 | -1.0 | -1.0","Come on man, there are only two types of people in the world: people who agree with me, and retards.  You see, Nextdoor is a reactionary echo chamber, while Reddit is a bastion of progressive and enlightened thought.  There is no middle ground.  Pick your side and grab your weapons...  Downvote anyone who makes you question your preconceived notions.  Stop trying to understand the other side.  It's all about tribalism now.  There are no nuanced positions, only absolutes.&lt;/s&gt;"
"138","elm85uc","hummingbirdpie","1556064847","","","","Damn! Your dog has better accommodation than many Bay Area humans."
