"idx","comment_id","author","created_utc","aspects","sentiments","scores","body"
"139","elm85zr","girl_incognito","1556064850","Nextdoor Platform Quality","negative","-1.0","I like the ones who are like ""Lost dog, please don't chase, don't use his name he hates that, eats only grilled chicken so make sure you carry some of that on every walk.  Fresh chicken only please.  Call us between the hours of 9:00 and 9:05 only, we won't answer otherwise.  We'd look for him ourselves but we're too busy."""
"140","elm89rb","noshore4me","1556064923","","","","South City *is* a suburb."
"141","elm8a60","dramabitch123","1556064931","Homeowner Property Values | Responsibility Attribution","negative | negative","-1.0 | -1.0","in their own houses that their parents help them buy with loans and values extracted from their primary residence that has risen in value from voting against more housing"
"142","elm8khd","girl_incognito","1556065137","Neighborhood Character Preservation | Nextdoor Platform Quality","negative | negative","-1.0 | -1.0","In my neighborhood it's always ""I saw a teenager in a hoody up to no good around 3pm.""

We live a couple blocks from a high school."
"143","elm8lpr","madworld","1556065160","","","","I can't stand the crap enough to get to the useful information. Same reason I quit Facebook."
"144","elm8q7n","ec20","1556065248","Nextdoor Platform Quality | Racial Coding Of Opposition | Neighborhood Character Preservation","negative | negative | negative","-1.0 | -1.0 | -1.0","Interesting. I only recently joined nextdoor after moving from Sunnyvale to South San Jose. The impression that I got on nextdoor was that South San Jose was a bunch of older, white, racist, anti immigration conservatives complaining about how the neighborhood was going to crap. I was like, man I knew South San Jose was going to be a little different from Sunnyvale, but I feel like I just moved to Redding. Hopefully it's more a sign of the nextdoor than the different demographic."
"145","elm8viz","FTFSM","1556065353","Homeowner Property Values | Responsibility Attribution | Neighborhood Character Preservation","negative | negative | negative","-1.0 | -1.0 | -1.0","Pisses me off. Last summer there was a group in Brentwood petitioning to prevent some ""low-income apartments"" from being built. I asked the lady how long she'd lived there, 7 years. Bitch, I'm third generation in Brentwood and have to move to lodi to afford an apartment. Better for my commute, but maybe we should push to move your old ass out of your new, country club houss."
"146","elm9bwp","Ploddit","1556065680","","","","Fair."
"147","elm9my2","greebytime","1556065898","","","","Yeah, I'm in Marin and - well, never mind, I suspect I don't need to finish that sentence."
"148","elma2bk","udonbeatsramen","1556066207","Housing Supply Expansion | Nextdoor Platform Quality","negative | negative","-1.0 | -1.0","Literally saw a post today lamenting the closure of a Black Angus (an “excellent restaurant”) because “the city will probably allocate the land for another 10,000 apartments”"
"149","elma9qo","compstomper","1556066352","Jobs-Housing Imbalance","negative","-1.0","i suppose i shouldn't have generalized.

but when you break it down by county, [it's not cute](https://imgur.com/a/0gwG7Zt). (i think i found the same report you're citing)

also found this snippet:

&gt;Housing growth continues to fall far behind job growth in the County. The San Francisco Bay
Area Planning and Urban Research Association reports that from 2010 through 2015, San
Jose created 171,000 jobs, but just 29,000 housing units. From 2010 through 2016,
employment in Silicon Valley jumped 29%, while housing inventory rose just 4%."
"150","elmaaqd","llama-lime","1556066371","Responsibility Attribution | Homeowner Property Values | Racial Coding Of Opposition","negative | negative | negative","-1.0 | -1.0 | -1.0","Yeah that's simply untrue, and the tech CEOs aren't showing up at the planning meetings to block housing. The tech CEOs, when they try to build housing, try to build it near the workplaces, not far away from the workplaces. It's local homeowners that stop the housing. . It's older whiter residents that show up at meetings and are the ones in control of local government."
"151","elmajl6","thecatgoesmoo","1556066548","","","","Nah just yell at them and burn shit, it's pointless"
"152","elmapc9","VROF","1556066662","Neighborhood Character Preservation | Parking Availability | Homeowner Property Values","negative | negative | negative","-1.0 | -1.0 | -1.0","Outer Sunset people want the small neighborhood feel and can’t handle the fact that the street parking is gone and single family homes are filled with roommates now"
"153","elmaqb7","jennanaa","1556066681","Nextdoor Platform Quality","negative","-1.0","Yeah and the frightening thing is that these are your real neighbors, not just some crazy anonymous people on Reddit or something."
"154","elmarha","thecatgoesmoo","1556066704","Parking Availability","positive","1.0","Don't own a car, simple!"
"155","elmazpn","SanFranRules","1556066867","","","","LOL at the kiddies who are too young to remember the first tech crash. They thought it could never happen back then too."
"156","elmb3rg","SanFranRules","1556066949","Responsibility Attribution | Racial Coding Of Opposition","negative | negative","-1.0 | -1.0","That's funny, because it's the policies of the **YIMBYs** that are pushing minorities out of Bay Area cities."
"157","elmb63p","Okay_Splenda_Monkey","1556066993","Nextdoor Platform Quality | Neighborhood Character Preservation","negative | neutral","-1.0 | 0.0","Yes, definitely it’s nextdoor.com not the neighborhood.  I think that site is toxic enough to drive away normal people."
"158","elmbcpc","compstomper","1556067121","Neighborhood Character Preservation | Building Height And Density","negative | negative","-1.0 | -1.0","oh south city.

[stumbled across this article a few months ago](https://sanfrancisco.cbslocal.com/2019/03/11/south-san-francisco-housing-development-earthquake-concerns/).

they don't want to build like 22 houses [on this dirt lot](https://www.google.com/maps/place/Oakmont+Dr+%26+Westborough+Blvd,+South+San+Francisco,+CA+94080/@37.6418799,-122.4633079,286m/data=!3m1!1e3!4m5!3m4!1s0x808f7a330d9efa5f:0xaa57dddce2d50949!8m2!3d37.642657!4d-122.4621338)"
"159","elmbe11","madlabdog","1556067148","Housing Supply Expansion | Responsibility Attribution","positive | neutral","1.0 | 0.0","Most of the problems pro-NIMBY people bring up are problems that the Bay Area would have face irrespective of the housing challenge. So you are right. Hearing their problems will encourage them to think about the root cause. One example, I had was I asked NIBMY folks is if the City stops all forms of new housing development. What other issues do they see?"
"160","elmc9la","compstomper","1556067782","Building Height And Density | Housing Supply Expansion","positive | positive","1.0 | 1.0","they're actually building a ton on grand rn"
"161","elmcfxl","inmeucu","1556067912","Neighborhood Character Preservation","positive","1.0","Some neighborhoods would benefit with beautifying change."
"162","elmclwc","compstomper","1556068029","Neighborhood Character Preservation","negative","-1.0","that's called atherton"
"163","elmd9cr","kehbleh","1556068494","Building Height And Density | Nextdoor Platform Quality","negative | negative","-1.0 | -1.0","&gt; ""this is what 8 stories looks like""

This is what a flier written by a douchebag looks like."
"164","elmdm2n","johnw188","1556068747","Responsibility Attribution | Jobs-Housing Imbalance","negative | negative","-1.0 | -1.0","""The City continues to approve more businesses creating this housing crisis"" lul"
"165","elmdp9c","diybrad","1556068809","Homeowner Property Values","negative","-1.0","but but but but muhhhhhhh propertaaaaay valoooooooos"
"166","elme7mf","diybrad","1556069178","Nextdoor Platform Quality | Racial Coding Of Opposition | Responsibility Attribution","negative | negative | negative","-1.0 | -1.0 | -1.0","I'm in Chinatown and my local nextdoor is 95% white people. Kind of a red flag.

Most of the posts are from one dude who is on a personal mission to rid the earth of the homeless. He just moved here recently and I'll let you guess what industry he works in. He once threatened to ""ruin my career"" when I pointed out he should maybe cool it, not every thread about events at the park needs to turn into a murderhobo rant. I then get a call at my office from someone who wants to ""speak to a manager"" about me.

I am self employed and the name of my business is My Name LLC."
"167","elmf4cv","SpontaneousLightBulb","1556069796","","","","&gt;[This is what 8 stories looks like](https://images.costco-static.com/ImageDelivery/imageService?profileId=12026540&amp;itemId=1122104-847&amp;recipeName=680)"
"168","elmfat1","SpontaneousLightBulb","1556069917","","","","&gt;Fresh *organic* chicken only please. 

FTFY"
"169","elmfjdl","akatsukix","1556070080","Nextdoor Platform Quality | Racial Coding Of Opposition | Responsibility Attribution","negative | negative | negative","-1.0 | -1.0 | -1.0","I used to go on there and be super-YIMBY. But Nextdoor is a cesspool of racism and bigotry - usually from the same people.

""Warning, a suspicious man was walking his dog near my property, police called."" Always a black dude."
"170","elmfxqs","codyd91","1556070362","","","","No shit, but when someone says ""Mowing the back 40"", it is not referring to their backyard being 40 acres. So it is not a literal reference to 40 acres, but a figurative one that may have been literal at one point."
"171","elmgicq","stupidusername","1556070776","Parking Availability","negative","-1.0","I'm not quite sure where i land on the permitted parking thing. I recently moved from a permitted area to a wild-west-no-street-sweeping area and while it's amazing not having to shuffle cars around at 8am, people are specifically driving over to this neighborhood to leave their vehicles for weeks at a time. i'm pretty sure they don't even live here, they just leave their work trucks and such on my block."
"172","elmhrua","rokstar66","1556071687","","","","https://www.youtube.com/watch?v=G__PVLB8Nm4"
"173","elmi6x2","neek3arak","1556071993","","","","I scored big time on a huge UFC dvd collection through that app.  But I also got banned from that app and I think it's because I was going back and forth between people on this post about a guy that 'saved' a dove from being eaten by two crows.  The guy said he picked up the dying dove and was talking to it. people were crying and praising this enlightening story"
"174","elmimo0","regul","1556072325","","","","Yeah I've been impressed. They're doing really good stuff with the downtown lately."
"175","elmj46k","outworlder","1556072689","","","","I live almost directly in the flight path from SJC. I hardly even notice, unless I'm outside. They have noise abatement procedures for a reason."
"176","elmjs45","Rodem","1556073189","","","","MAKE SOME NOWOIS !!!!"
"177","elmk6ty","KCrobble","1556073497","Parking Availability | Transit Proximity","negative | neutral","-1.0 | 0.0","That can't be in SF though, right?  I have never seen a neighborhood without street sweeping.

Regardless, the remedy for that is calling in the car as an abandoned vehicle.  It gets towed away if not moved in 48 hours.

The permit system is supposed to prevent outside commuters from taking neighborhood spots for workaday parking (or BART.)  It doesn't really fix the ""my neighbor's garage is full of crap, so they park their car in front of my house"" nonsense I was arguing with."
"178","elmltye","macegr","1556074760","","","","But NIMBY people literally don't have anything in their back yards, it is a cube of absolute vacuum!"
"179","elmm99s","pdp_8","1556075099","Nextdoor Platform Quality | Neighborhood Character Preservation | Homeowner Property Values","negative | negative | negative","-1.0 | -1.0 | -1.0","&gt; toxic stew of crazy old people

Gawd, tell me about it. There's a [huge retirement community](https://oakmontseniorliving.com/) in my Nextdoor ""neighborhood."" Every evening I arrive home to the sound of ""get off my lawn!"" echoing across the hillsides..."
"180","elmmemf","blbd","1556075217","","","","There's already a solution for this since decades. We just need to deploy it. You can install megaphone train horns which point directly down at the road and then quit using the stupid one on the train. That's what they did at the entire massive Roseville rail yard out by Sacramento."
"181","elmmgg3","pdp_8","1556075257","","","","Remember the black Prius ""casing the neighborhood"" that turned out to be the paper thrower? Or how about the Sonic techs inspecting poles who were clearly pretexting, nevermind the fleet of Sonic bucket trucks they were emerging from.

If I start acting that way when old I'm going to find a high place to jump from."
"182","elmmqvj","blbd","1556075488","","","","I'd never heard chud before reading your post but now that I've seen it and read the definition on Urban Dictionary I'm going to be using it to describe this particular type of miscreant very often from here on out."
"183","elmmvjc","pdp_8","1556075592","Racial Coding Of Opposition","positive","1.0","""People who look like they're maybe from the Marina"" in San Rafael, I'm guessing."
"184","elmmwpy","blbd","1556075617","Homeowner Property Values | Racial Coding Of Opposition","negative | negative","-1.0 | -1.0","I've never thought that the property values were the primary reason. I've always thought it was racial and economic discrimination behind it."
"185","elmn8k8","sugarwax1","1556075888","Racial Coding Of Opposition | Responsibility Attribution","negative | negative","-1.0 | -1.0","I wish racist loser Sonja Trauss and M. Justin Herman quotes were easier to tell apart then.

Who said ""gentrification is desgregation"" or ”gentrification is what we call the revaluation of black land to its correct price.”  and who said ""Racism will be fought. Segregation will be gouth. Destructiveness will be fought. Poverty will be fought. Not theoretical but down to earth programs and projects that respect and encourage the rights and individuality of people will guide""?"
"186","elmnaru","codyd91","1556075937","Neighborhood Character Preservation | Nextdoor Platform Quality | Responsibility Attribution","negative | negative | negative","-1.0 | -1.0 | -1.0","But the ""backyard"" in ""not in my backyard"" is not referring to people's literal yards. No one has wind turbines in their backyards except farmers. But it is residents at large that oppose them. And unlike the back 40, it never was about a literal backyard. 

The literal gist of ""NIMBY"" is ""let's do that good and noble thing that will help society...just not where *I* live."" Take Marin County voting mostly for legalization of marijuana, but few cities will allow it, because the residents thing dispensaries will bring in shady characters. Same with why BART never got an extension to Marin. And was a big hurdle for SMART.

God, I would hate to go through a Nextdoor in Marin. I'll avoid that, thank you. Marin is the nexus of NIMBYism. Anyways, I'll stop before I go on a *real* rant."
"187","elmnay0","sugarwax1","1556075941","Nextdoor Platform Quality | Racial Coding Of Opposition","negative | negative","-1.0 | -1.0","Not really defending Nextdoor, obviously. I see some pretty exploitative talk about brown people on Reddit get massively upvoted though."
"188","elmnrly","blbd","1556076312","Housing Supply Expansion | Responsibility Attribution","positive | positive","1.0 | 1.0","Infill redevelopment of inefficient structures based on paying market prices is a success not a failure."
"189","elmnx3s","macegr","1556076435","Homeowner Property Values | Responsibility Attribution","negative | negative","-1.0 | -1.0","I think the REAL gist of NIMBYism is that they really don't care about doing that good elsewhere, either. They just have to say that they want it in order to not unmask themselves as greedy sociopaths."
"190","elmo5bi","codyd91","1556076615","","","","Yeah, that's the more likely possibility."
"191","elmo9fm","blbd","1556076706","Tax Structure And Public Finance | Responsibility Attribution | Neighborhood Character Preservation","positive | negative | neutral","1.0 | -1.0 | 0.0","Take it easy for a minute there...

I've been known to consistently vote down measures for complicating our lawbooks with illogical and irrelevant requirements devised by manipulative interest groups in favor of pushing for more properly thought out solutions enacted by legislators. Ballot measures and their defective and overriding clauses are a top contributor to California's ungovernability. 

But I never vote against properly thought out proposals to improve our tax collection processes and ensure we're properly budgeting for government. I just want to help them do the job quickly and simply and flexibly instead of dumping more voter overrides on their head. 

We've got the highest US poverty rate when adjusting for purchasing power parity and I want real solutions not messy ballot measures."
"192","elmrgle","Ofthedoor","1556079483","Nextdoor Platform Quality | Racial Coding Of Opposition","negative | negative","-1.0 | -1.0","Nextdoor is for chronically depressed self righteous white people.

Decent to find services and sell stuff though."
"193","elmtx3o","gullinbursti","1556081615","","","","Back when I lived in Florida, I was just under a mile north from either end of Ft. Lauderdale Int'l airport. Really sucked trying to watch TV with the windows open."
"194","elmunwv","jashsu","1556082278","","","","A less scrupulous version of you would have pretended to be your company's HR and collected his personal call back number then submitted it to a bunch of telemarketer lists. Luckily you're more high minded than that."
"195","elmvq7m","xinabobina","1556083256","","","","They can't really come talk to you, because what they are upset about is actually none of their business and they know it."
"196","elmwkbs","MustLetTomPickOnion","1556084048","Racial Coding Of Opposition | Nextdoor Platform Quality","neutral | negative","0.0 | -1.0","That sounds like something a “NIMBY” would say. Downvoted!"
"197","elmy827","jrhoffa","1556085894","","","","Why, was your volume knob broken?"
"198","elmyapb","jrhoffa","1556085987","","","","Wow.  I can't even come up with a sarcastic comment."
"199","elmyu8b","cryonine","1556086696","Neighborhood Character Preservation | Building Height And Density | Homeowner Property Values","negative | negative | positive","-1.0 | -1.0 | 1.0","Because many genuinely believe it will “ruin the feel” of the neighborhood. It’s not limited to just housing either, it’s cars, scooters, bike shares, and he’ll even renovations on SFHs that increase their property value."
"200","eln18fy","jasnooo","1556090012","Housing Supply Expansion | Homeowner Property Values | Neighborhood Character Preservation","positive | negative | negative","1.0 | -1.0 | -1.0","Nope.  I was a NIMBY back in San Diego when I owned a house.  Now I don't give a shit.  Change it all you want.  Cram every last person into CA.  I'll just move if things suck.  I always roll my eyes when someone thinks they have it all figured out though.  NIMBY or YIMBY both come with problems."
"201","eln1mzw","MustLetTomPickOnion","1556090609","","","","Neither is an actual thing - they are terms used to try to control a more complex conversation than most proponents of it can apparently handle."
"202","eln42q1","gimpwiz","1556094493","","","","Reminds me of Mr Mackey saying he doesn't think people should _scoot_."
"203","eln6rmd","yungkerg","1556098866","Housing Supply Expansion | Responsibility Attribution","positive | negative","1.0 | -1.0","This is the fault of the dumbass city not building enough housing not the business."
"204","elngina","ImRickJameXXXX","1556109364","Nextdoor Platform Quality","negative","-1.0","Oh may not a new/additional services like a police &amp; fire Dept!

I tried Nextdoor for about 6 months but it was not what I thought it would be. About 10% was useful knowledge of goings on in my Neighbor hood. But it was not worth wading through all the hate and bullshit arguments."
"205","elnsfgo","PUTISIMALAVENDEHUEVO","1556117395","","","","Best stories ever!"
"206","elnsqfo","DonkeyGuy","1556117578","Racial Coding Of Opposition | Nextdoor Platform Quality","negative | negative","-1.0 | -1.0","Didn’t they have to implement a checklist system to make sure people on their “Public safety” page were not just reporting Black People for no reason?  Just “being suspicious”?"
"207","elnu7v4","listsandthings","1556118463","","","","That is until you start a thread about the jet noise"
"208","elnvibq","coastalsfc","1556119245","","","","lol yea that one is classic."
"209","elnvzo0","amigo1016","1556119536","","","","Who was this?"
"210","elnw1zo","SanFranRules","1556119575","Responsibility Attribution","negative","-1.0","...and the fault of the companies for building huge office complexes in areas they knew didn't have the housing to meet the needs of their employees."
"211","elnwps9","fizuk","1556119961","","",""," https://twitter.com/bestofnextdoor"
"212","elnx80a","aetolica","1556120271","","","","I think meeting people face to face is helpful.  When you know someone personally (met at a community group, farmer's market, block BBQ, other social event) they are less likely to be hostile and more likely to have a conversation."
"213","elnxmbj","yungkerg","1556120509","Responsibility Attribution | Jobs-Housing Imbalance","negative | neutral","-1.0 | 0.0","the purpose of a business is generate economic activity not build housing. this is entirely the fault of the city because it is the city that controls these things"
"214","elnxpty","aetolica","1556120567","Racial Coding Of Opposition | Nextdoor Platform Quality","negative | negative","-1.0 | -1.0","In my area, someone called the police because a van of people who ""didn't look like they belonged"" where parked in her neighborhood mid-day.  Turns out they were the neighbor's cleaning crew of presumably Hispanic people.  She was bitching because they laughed at her as she stood there watching them on her phone, and because her neighbor didn't fire them because of the way ""they treated her.""  She felt like she was doing her civic duty.  Like damn woman, why didn't you just ask them what they were doing there?  Then watch them enter the house with their KEY and CLEANING SUPPLIES to verify the story!?

Another time, someone posted a photo of a young black man walking down the street, claiming that he was stealing packages and breaking into cars.  She said the police told her to post his photo and to call them if he was spotted in the area.  I didn't believe her and said she shouldn't post the photo of a minor.  She deleted the post in a rage when I asked for the name and number of the police officer who told her that so I could follow up with his commanding officer.  LOL."
"215","elnxxe3","aetolica","1556120688","Jobs-Housing Imbalance | Responsibility Attribution","negative | negative","-1.0 | -1.0","Definitely part of the problem.  Look at Cupertino, SF, San Jose.  It's like they aren't even trying to match the jobs-housing balance."
"216","elnyrox","hefnetefne","1556121201","","","","""I DON'T LIKE DIFFERENT. I LIKE SAME."""
"217","elo0g3q","John-AtWork","1556122210","","","","Ok, I'm a bit old, but the way people act today about dogs is just weird to me.  They are dogs folks, not children."
"218","elo13av","joe_pel","1556122596","Transit Proximity","positive","1.0","Anything walking distance from a train is absolute gold."
"219","elo163u","nutationsf","1556122645","Housing Supply Expansion | Homeowner Property Values","positive | neutral","1.0 | 0.0","I think at least 20% are below market rate too"
"220","elo174h","sfo2","1556122661","Homeowner Property Values | Racial Coding Of Opposition | Nextdoor Platform Quality","negative | negative | negative","-1.0 | -1.0 | -1.0","Omg.  We make fun of this so much.  SAVE OUR SKIES!  THE FAA NEXTGEN IS DECREASING OUR PROPERTY VALUES!  MAKE THEM FLY OVER POOR NEIGHBORHOODS!!"
"221","elo1vrl","mrkotfw","1556123073","","","","What did they say?"
"222","elo1zuj","diybrad","1556123140","Building Height And Density | Neighborhood Character Preservation | Transit Proximity","negative | negative | positive","-1.0 | -1.0 | 1.0","Fucking seriously. I live next to BART, Amtrak, and a fire station. I don't 'hear' any of this shit.

I think all bay cyclists have seen those houses out near Nicasio that have signs saying ""Imagine a 1000 voices in your front yard - please be quiet""

Yeah bitch I live between two schools, the sound of a 1000 voices is called civilization."
"223","elo2cpr","mrkotfw","1556123344","","","","I would buy burritos and beers for the workers and have them sit in the front lawn"
"224","elo2o9w","madlabdog","1556123543","Tax Structure And Public Finance | Housing Supply Expansion","negative | negative","-1.0 | -1.0","Lot of their apprehensions stem from the fact that the  cities do not have sufficient resources handle the current state of affairs. So usually their reasoning is why make the problems worse."
"225","elo2vc9","mrkotfw","1556123653","","","","Fuck those people."
"226","elo3b8u","joe_pel","1556123921","Transit Proximity","positive","1.0","It's totally unreal how valuable transportation like Bart is.  It opens up so many avenues to people who can't afford reliable transportation. Personally I would love to sit and play my switch while I commute more cheaply than driving."
