"idx","comment_id","author","created_utc","aspects","sentiments","scores","body"
"227","elo3vw2","diybrad","1556124257","Responsibility Attribution | Neighborhood Character Preservation | Nextdoor Platform Quality","negative | negative | negative","-1.0 | -1.0 | -1.0","They're not being ""dumb"" they want the tax money without having to deal with any actual real people or real issues.

This is why the Bay Area should have some sort of regional metro authority that can tell these towns to go fuck themselves."
"228","elo40zu","ayobnameduse","1556124336","","","","The Danielle Steele issue is from 2002. You were incorrect three years ago."
"229","elo41sb","mrkotfw","1556124348","Housing Supply Expansion | Neighborhood Character Preservation | Responsibility Attribution","neutral | neutral | neutral","0.0 | 0.0 | 0.0","My argument to them is if a developer builds, the infrastructure needs to improve.

I've heard the same argument, but it's usually of the two flavors:

1. We can't build housing until fix X
2. X is broken, therefore let's not build housing"
"230","elo4486","ayobnameduse","1556124387","","","","Many hilly streets in SF don't have street sweeping."
"231","elo47p9","mursilissilisrum","1556124443","Nextdoor Platform Quality | Neighborhood Character Preservation","negative | negative","-1.0 | -1.0","&gt;If you want to hate your neighbors, it's the Internet site for that sort of thing.

So's r/bayarea, apparently.  If you drop the victim identity and quit trying to talk down to the locals then you'll have a way better time."
"232","elo52q4","hefnetefne","1556124933","Neighborhood Character Preservation | Nextdoor Platform Quality","negative | negative","-1.0 | -1.0","Emeryville is basically an incorporated outlet mall."
"233","elo5bai","KCrobble","1556125070","Parking Availability","neutral","0.0","Limit Four (4) Permits Per Address
A maximum of four active annual residential permits may be issued to a single address in all areas with the exception of AA and EE.

...

In special circumstances, you may request a waiver to this limit. Waivers will be granted if there is available parking in the area and if there is an additional driver at the address.

https://www.sfmta.com/permits/residential-parking-permits-rpp"
"234","eloa1iz","SanFranRules","1556127924","Jobs-Housing Imbalance | Responsibility Attribution | Housing Supply Expansion","negative | negative | negative","-1.0 | -1.0 | -1.0","Having to pay workers more because housing is super expensive because you built an office for 10,000 workers in an area that doesn't have enough units for them to live in isn't smart business and leads to the kind of housing crisis we have now."
"235","eloc3il","fhinewine","1556129117","","","","Rockridger here, I can't help but take the bait every time (usually monthly or so) I see some shit about new cell towers and how it's going to fray all of our brains with cancer waves. It's the most frustrating and insane thing ever."
"236","elocch0","sfo2","1556129260","","","","DON'T LET THE GOVERNMENT INSTALL 5G NEAR YOUR HOUSE.  written by a non-technical octogenarian, and followed by a rambling, incoherent set of 6 paragraphs."
"237","elocmce","fhinewine","1556129419","Nextdoor Platform Quality","negative","-1.0","Hi neighbor! Welcome to our beautiful, convenient, socially hellish neighborhood"
"238","eloda1b","fhinewine","1556129818","Homeowner Property Values | Nextdoor Platform Quality","negative | negative","-1.0 | -1.0","I would almost respect it more if they went with the obvious ""fuck cell towers, they look ugly and I don't want one lowering my property value on the sidewalk in front of my house"" - that's still a bad take, but it's better than all this borderline antivaxx/science denier fearmongering BS."
"239","elodj6l","yungkerg","1556129974","Housing Supply Expansion | Responsibility Attribution","positive | negative","1.0 | -1.0","Okay but you see how all of this is just the consequence of not building enough housing right? The city controls that, not the business"
"240","elodqrq","SanFranRules","1556130103","Responsibility Attribution","negative","-1.0","The business intentionally moved into an area with no housing and did not make any demands that housing for their workers be built. The business is equally responsible."
"241","elof4tm","sfo2","1556130909","Homeowner Property Values | Neighborhood Character Preservation | Responsibility Attribution","negative | negative | negative","-1.0 | -1.0 | -1.0","I think it's post-hoc rationalization.  I don't want this thing (either because of property value impact, or because I'm scared of it), so let me find some justification for why."
"242","elofc0w","yungkerg","1556131026","","","","So businesses shouldve lobbied for housing to be built?"
"243","elogatc","SanFranRules","1556131591","Responsibility Attribution | Jobs-Housing Imbalance | Housing Supply Expansion","negative | negative | positive","-1.0 | -1.0 | 1.0","Absolutely. Building giant offices gives companies huge leverage. Facebook and Apple should have demanded that the cities they put their offices in fast track the development of large amounts of housing on an accelerated timeline.

OR just not put their shiny new HQs in cities that were already having housing shortages."
"244","elp4tos","GoldenChurro","1556146514","","","","Or Palo Alto apparently."
"245","elp5fbw","fried_green_baloney","1556146932","Neighborhood Character Preservation | Homeowner Property Values","negative | neutral","-1.0 | 0.0","Or the Mission.  Since a one bedroom rents for $4000, maybe the old Mission is gone forever.

Similar in Silicon Valley."
"246","elpjdop","aplomba","1556156622","","","","if anyone is confused by this, realize that nobody wants to be around you fuckboys"
"247","elpoo6r","manitobot","1556160142","Racial Coding Of Opposition | Responsibility Attribution","positive | negative","1.0 | -1.0","Both of you clearly haven’t understood the history of redlining if you think urban development in the modern day doesn’t at least have some internalized racial biases."
"248","elq4bqj","speedyspaghetti","1556173198","Racial Coding Of Opposition | Neighborhood Character Preservation | Homeowner Property Values","negative | positive | positive","-1.0 | 1.0 | 1.0","Yes, but this particular issue has literally nothing to do with anything related to race.  
  
If you bought a house in a quiet single family neighborhood because that's what you wanted and what you spent your money on, you don't think you'd be a little upset if all of a sudden a bunch of multi-story buildings started sprouting up around you? I know people love to assume that everyone who has a single family home in this area is some rich entitled asshole, but there are plenty of people who grew up here, call this home, and who would not be able to rebuy their own homes if they sold because of the tax hike. Meanwhile, Apple, Google, and Facebook are causing the housing crisis, impacting schools, impacting traffic, all while using every loophole and scheme in the book to avoid taxes without contributing a thing to those that don't work for them."
"249","elq52ar","manitobot","1556173966","Racial Coding Of Opposition","negative","-1.0","I guarantee the old white residents don’t like the new multi-family housing in more ways than one. To say they don’t harbor any animosity to different ethnic groups possibly moving into their neighborhoods is naive at best."
"250","elqcjw7","thespiffyitalian","1556182916","","","","There's no way that could be real. They don't need your password to do anything to your account. That sounds like a phishing scam."
"251","elqq0rs","PUTISIMALAVENDEHUEVO","1556197289","","","","Damn hurting my feelings here yo!"
"252","elqqyoi","KCrobble","1556197951","","","","It's real. 

I contacted them, -not the other way around, and another user in this thread had the same experience

Crazy, I agree"
