"idx","comment_id","author","created_utc","aspects","sentiments","scores","body"
"0","ellk274","nutationsf","1556048600","Building Height And Density | Transit Proximity | Neighborhood Character Preservation","neutral | positive | negative","0.0 | 1.0 | -1.0","“Neighborhood”  next to a huge 5 story hospital with a 5 story parking garage, on El Camino walking distance to BART."
"1","ellkcsy","txiao007","1556048780","","","","Username check out.  lol"
"2","ellkw20","tghetto","1556049095","Housing Supply Expansion | Responsibility Attribution","positive | negative","1.0 | -1.0","I don't understand how short-sighted some people can be..blaming businesses for creating the housing crisis? Seriously? The lack of building new dwellings is causing this housing crisis!"
"3","elll7sc","yappary","1556049287","Responsibility Attribution | Nextdoor Platform Quality","negative | negative","-1.0 | -1.0","This is likely the woman behind everythingsouthcity.com who used her publication to promote herself for a city council seat without giving equal time to her opponents or declaring it as a donation to her campaign violating campaign finance laws. Sore looser much?"
"4","ellmhll","dave5104","1556050054","Jobs-Housing Imbalance | Housing Supply Expansion","negative | neutral","-1.0 | 0.0","But aren’t some cities approving more office space than their housing inventory can support? I guess that doesn’t make much sense in this posting’s context, but I thought that was part of the problem too. Some cities have 3-4x jobs than they do housing beds."
"5","ellmybq","skyshadow42","1556050340","","","","Forget the NIMBYism, can we talk about the horrible writing? Good God, hire a freelancer to copy edit this shit or something."
"6","elln8xh","ikiller","1556050522","Jobs-Housing Imbalance | Responsibility Attribution | Housing Supply Expansion","negative | negative | negative","-1.0 | -1.0 | -1.0","Since 2010 SF has added jobs eight times faster than housing.   It's not rocket science how this ""crisis"" was created.

It's way faster and easier to add jobs than housing.  There is no possible way to add housing fast enough to keep up or catch up (not enough money, available land, construction workers, or interested developers) so what does the city do?  Adds more jobs and blames the crisis on surounding areas for not adding enough housing.

The easiest solution to this ”crisis"" is to incentivize businesses to move the jobs to where the housing/workers already are.  Simple economics, supply and demand.   Again it is easier to create jobs in a location than housing, infrastructure wise.

 People in the cheaper burbs want jobs closer to home, businesses want to be in an expensive hip city.  Why are we once again deferring to corporations as if they have our best interests in mind?  YIMBYs are just corporate boot licking aopologists."
"7","ellnb36","tghetto","1556050559","Jobs-Housing Imbalance | Tax Structure And Public Finance | Responsibility Attribution","positive | positive | negative","1.0 | 1.0 | -1.0","Well yeah, some cities do approve more business space than they do residential space. There is an incentive for it, financially speaking, because businesses bring a bigger revenue to the city than residential units would. But when it comes to constructing residential units, it certainly doesn't help when you have NIMBY neighbors posting stuff like this trying to prevent construction from happening."
"8","ellnntj","sugarwax1","1556050768","Nextdoor Platform Quality | Housing Supply Expansion | Responsibility Attribution","negative | negative | negative","-1.0 | -1.0 | -1.0","So you're saying it bothers you that a lot of people disagree with your ideals and urbanist ideology? 

Nextdoor is bottom of the barrel... get out there in the real world and realize YIMBY'ism is fringe."
"9","elloafe","historicc_laundromat","1556051142","Building Height And Density","negative","-1.0","The tower just got ten stories higher!"
"10","ellogds","historicc_laundromat","1556051239","Building Height And Density | Neighborhood Character Preservation","negative | negative","-1.0 | -1.0","The writing may be shit, but at least they included a diagram of an 8-story building. I've never actually left the suburbs, so the concept of an 8-story building is hard for my shriveled nimby pea brain to visualize."
"11","ellp3ba","frownyface","1556051622","Jobs-Housing Imbalance | Tax Structure And Public Finance","positive | negative","1.0 | -1.0","The two are pretty obviously related.  When you add jobs it attracts residents.

California cities love zoning for businesses because they can tax them in ways that track inflation.  Prop 13 makes it that zoning for mostly residential ends up being a dead end, the taxes don't track inflation and highly residential cities end up poor since that's the primary tax residents pay to city governments.

https://en.wikipedia.org/wiki/California_housing_shortage#Tax_structures"
"12","ellp6ui","manitobot","1556051682","Neighborhood Character Preservation | Racial Coding Of Opposition","negative | negative","-1.0 | -1.0","*This will forever change the feel of our neighborhood...*

More like *”Oh dear, Coloreds will be moving in!”*"
"13","ellpguq","TheJadedSF","1556051851","Nextdoor Platform Quality","negative","-1.0","Gold mine for a lot more than that... Nextdoor might be the one site that is more toxic than Facebook. Sad thing is knowing you are neighbors with some of those assholes. Although there are *some* useful posts from time to time, especially for lost pets."
"14","ellqmzp","Ochotona_Princemps","1556052563","Jobs-Housing Imbalance | Tax Structure And Public Finance","positive | negative","1.0 | -1.0","Were you here when the great recession hit? It is easy to say ""we don't need to build more homes, just drive away the jobs"" in the abstract. It is very difficult to do so when you're facing an actual budget crisis, with inflexible pension costs and infrastructure maintenance needs."
"15","ellqp0t","sugarwax1","1556052599","Racial Coding Of Opposition | Nextdoor Platform Quality","negative | negative","-1.0 | -1.0","Urban Renewal 2.0.... ""for the Coloreds""?  See, not so funny that your mind went there."
"16","ellqq5e","MustLetTomPickOnion","1556052618","Nextdoor Platform Quality | Responsibility Attribution","negative | negative","-1.0 | -1.0","If the “YIMBYS” ever figure out a way to advance their cause without slurring anyone who disagrees, I bet they might actually make some headway. No one wants to assist people like that."
"17","ellrgox","refurb","1556053078","Building Height And Density","negative","-1.0","Not they want 8!!!"
"18","ellrtad","Okay_Splenda_Monkey","1556053297","Nextdoor Platform Quality | Racial Coding Of Opposition","negative | negative","-1.0 | -1.0","Nextdoor.com in my neighborhood is a toxic stew of crazy old people complaining about anything and everything.  If you want to hate your neighbors, it's the Internet site for that sort of thing.  It's not quite Q conspiracy theorizing racists, but it's at least adjacent in terms of the Internet ecosystem."
"19","ellsbl0","ikiller","1556053632","Jobs-Housing Imbalance | Responsibility Attribution | Homeowner Property Values","negative | negative | negative","-1.0 | -1.0 | -1.0","Oh yeah, I miss that sweet recession, and they one before it.  Awesome traffic, less transplants complaining about how the region isn't changing fast enough to suit their lifestyles

When the next recession hits all these recent dream chasers get to go home to their communities they left to rejoin friends and family they left behind.  While we are left here with our gutted community, the middle class backbone driven out forever, and all our friends and family scattered.

There is s huge difference between encouraging economic growth and creating a toxic situation.   And I'm not sure how this boom has helped with any of the region's budget problems.  We still don't have enough money for pensions, infrastructure, or education.

The simple policy change would be to tax businesses based on employee commute.  Then businesses could figure out the optimum solution that fits their needs."
"20","ellsl8t","AncileBooster","1556053815","Housing Supply Expansion | Parking Availability | Building Height And Density","positive | negative | neutral","1.0 | -1.0 | 0.0","While I agree that the units should go up, he makes a good point about parking.  A lot of neighborhoods need more parking space.  As it is, I'm parking over a block away from my apartment with another 2 developments in the pipe.

170 unit building is going to bring in close to 300 cars that will need to be parked *somewhere*."
"21","ellsr1g","Maximillien","1556053920","Housing Supply Expansion | Responsibility Attribution","negative | negative","-1.0 | -1.0","It's pretty mind-blowing that they are able to acknowledge the housing crisis, *while arguing against building more housing*, in the same presentation. 

I can't even imagine what's going on in their brains. What do they think ""housing crisis"" means??"
"22","ellth3g","leicanthrope","1556054391","Nextdoor Platform Quality | Racial Coding Of Opposition","negative | negative","-1.0 | -1.0","Have you ever actually been on Nextdoor?  Panicking about random brown people walking down the street is pretty much the order of the day for a significant proportion of the user base."
"23","elltn4a","TaviRider","1556054498","","","","Which company is behind SSFResidents4SmartGrowth.com?"
"24","ellu0nt","Maximillien","1556054734","Neighborhood Character Preservation | Racial Coding Of Opposition","negative | negative","-1.0 | -1.0","God, I wish you could understand the difference between regular housing development and Urban Renewal, but I know you can't/won't. But just a little tip, the [co-opting of a brutal and racist chapter in US history to support modern-day anti-housing activism](https://abc7news.com/society/racist-offensive-propaganda-sf-leaders-react-to-political-mailer/5259374/) (colloquially referred to as NIMBYism) is generally not well received."
"25","ellu8vt","andoman66","1556054878","Nextdoor Platform Quality","negative","-1.0","Only experience I've had with it was a landlord sending me a Nextdoor complaint when I first moved into their rental house. I guess a neighbor was up in arms that my dog had a huge backyard and empty two car garage to play around in while I'm at work. They ended up getting persuaded by the other users to call animal control on me for animal abuse. Animal control came by, saw my pet friendly converted garage with dog door accessibility, fans (for rare warm days in SF), second dog bed, auto water feeder, two story dog house I built for my dog in the back yard, and confirmed I work 7:30-4pm. They just laughed and told me to ignore the complaints. Thanks Nextdoor.com folks for making a mountain out of a mole hill. The neighbor could have easily left me a note if they were concerned, they lived two houses over."
"26","ellumvt","Bensonian170","1556055134","Housing Supply Expansion | Responsibility Attribution | Homeowner Property Values","positive | negative | negative","1.0 | -1.0 | -1.0","Idiots. The only way to alleviate the housing crisis is to build more supply. I hope they block the whole building and dig their own grave to being pushed out of the Bay Area. Good riddance."
"27","elluqde","theflash1011","1556055198","Neighborhood Character Preservation | Responsibility Attribution","negative | negative","-1.0 | -1.0","God forbid the city build a new fire department and first responder/ 911 operator center!

SMDH. SSFResidents4SmartGrowth my ass."
"28","ellusiy","Okay_Splenda_Monkey","1556055239","Nextdoor Platform Quality | Neighborhood Character Preservation","negative | neutral","-1.0 | 0.0","In my neighborhood there was a series of posts about a ""suspicious individual"" seen driving and wandering around the neighborhood.  He was a gardener who someone had hired to work on their yard during the day while they were at work.  Yeah, mountains out of mole hills is a real theme."
"29","elluyks","Puggravy","1556055351","Responsibility Attribution | Homeowner Property Values","negative | negative","-1.0 | -1.0","Businesses creating the housing crisis? LOL, yeah I've lived in the bay my whole life and I've never heard any more transparent scapegoating. I knew I wasn't gonna be able to Afford rent in the neighborhood I grew up in when I was like *12*, the whole time from then until now I had to listen to the B.S narrative was that there wasn't a housing problem at all. Now that even the most recalcitrant political hacks can't deny that there is a housing crisis it is 'someone else's fault'. Uh, excuse me, no, we brought it on ourselves by acting like the world's biggest and shittiest HOA."
"30","ellv61p","macegr","1556055486","Nextdoor Platform Quality | Neighborhood Character Preservation | Racial Coding Of Opposition","negative | negative | negative","-1.0 | -1.0 | -1.0","My Nextdoor radius catches Alameda, full of this demographic. There's a huge battle stewing over converting an old government building into a respite care center for elderly homeless. One of the leaders of the movement against this said they can't be NIMBYs because a lot of the residents nearby live in apartments and don't have back yards."
"31","ellvbb0","nycfire","1556055583","Racial Coding Of Opposition | Nextdoor Platform Quality","positive | negative","1.0 | -1.0","I suspect they would try to phrase it like ""I'm not a racist, but we need to make it harder for others to move in."""
"32","ellvcnm","waka_flocculonodular","1556055610","","","","You don't even need to go to Nextdoor. Atherton police blotter is the freshest source of these idiots wasting 911's time

&amp;#x200B;

[https://www.mercurynews.com/2011/08/27/the-best-of-atherton-police-blotter/](https://www.mercurynews.com/2011/08/27/the-best-of-atherton-police-blotter/)

&amp;#x200B;

\&gt;A pedestrian was reported after midnight wearing black pants and a white dress shirt.

&amp;#x200B;

\&gt;Four or five juveniles were reported to be running around at Selby Lane School and involved in “horseplay” on a summer afternoon."
"33","ellvdlp","KCrobble","1556055628","Parking Availability | Nextdoor Platform Quality | Neighborhood Character Preservation","negative | negative | negative","-1.0 | -1.0 | -1.0","^ This

I got into it with some folks on there who wanted to apply to the city of SF to turn our neighborhood into a permitted parking area because they have neighbors ""with too many cars.""  

When I pointed out that parking permits have no limit on the number of cars and that they were trying to impose a $200/year fee on every resident with a car (regardless of whether they had ""too many"" or not) in an attempt to harass their befleeted neighbors the hate began.

Soon, my account was frozen by Nextdoor because I didn't use my full name (used initials.)  Nextdoor support asked me for my password and real name so they could update my profile for me.  I told them to unfreeze my account and I would update it myself.  

They said ""no,"" so I told Nextdoor to consume an unstructured textile container full of male genitalia. 

I am sure that the parking permit NIMBY's initiated the problem, so in that sense they won."
"34","ellvfky","PUTISIMALAVENDEHUEVO","1556055665","Nextdoor Platform Quality | Neighborhood Character Preservation | Housing Supply Expansion","negative | negative | negative","-1.0 | -1.0 | -1.0","I follow that page because I live in SSF and damn that page is always sour about new development. It's ridiculous."
"35","ellvs11","codyd91","1556055901","Neighborhood Character Preservation | Nextdoor Platform Quality","negative | negative","-1.0 | -1.0","lmao taking ""backyard"" to its most narrow definition. Someone should introduce em to the phrase ""back 40"", since it is an idiom that doesn't literally refer to 40 acres.

Amazing to me how people dumb themselves down in order to feel in the right."
"36","ellvs5j","yappary","1556055903","Transit Proximity | Building Height And Density | Nextdoor Platform Quality","positive | positive | negative","1.0 | 1.0 | -1.0","You would think housing near BART would be a no brainer especially in a large building that would block the traffic noise from El Camino. I think anonymous websites that are trying to come off as community voices are shady AF."
"37","ellvwhy","dialleft","1556055986","Responsibility Attribution | Nextdoor Platform Quality","positive | neutral","1.0 | 0.0","Election was April 9. NIMBYs lost."
"38","ellvyfe","lunartree","1556056024","Responsibility Attribution | Homeowner Property Values","negative | negative","-1.0 | -1.0","Seriously, fuck these senile NIMBY assholes. They want us to all suffer because they're delusional."
"39","ellvzy6","plainlyput","1556056054","Nextdoor Platform Quality | Neighborhood Character Preservation | Parking Availability","negative | neutral | negative","-1.0 | 0.0 | -1.0","I see this all the time on my next door. I point out that 10 yrs ago I lived in SF, &amp; more than once had to park a mile+ away, &amp; this was in the mid Richmond. Aside from looking for the actual space, I found the walk calming. Welcome to the Bay Area. If there's one thing that's a constant it's change."
"40","ellwbix","rdewalt","1556056274","Nextdoor Platform Quality | Housing Supply Expansion | Homeowner Property Values","negative | positive | negative","-1.0 | 1.0 | -1.0","nextdoor is what you use if you want to know which of your neighbors to avoid at all costs.   I've yet to see a regular poster that wasn't a pearl-clutching ""I need to speak to your manager""  lexus-means-I-am-immune-to-traffic-laws fuckburger.

its this fight against housing that is causing housing prices to stay highest on the planet... fuck that."
"41","ellwkgu","StoneCypher","1556056449","Building Height And Density | Housing Supply Expansion","negative | positive","-1.0 | 1.0","And yet if you set the hedge logic aside and look at the statistics, every city in America with a rent problem also has severe usage and height restrictions."
"42","ellwqpb","ready-ignite","1556056571","","","","&gt;  It's not quite Q conspiracy theorizing racists

The Q conspiracy theorizing racists have been incredibly good entertainment the last week or two.

The old anon community increasingly grew tired of their antics with an ever growing pool of figures going after the people behind the accounts. And growing frustration and anger from the Q community in the face of the trolling coming out of that effort.

Yesterday they were playing the game 'Who can post as Q' after finding a method to retrieve the tripcode access then flooding the chan boards mocking the racists running the larp.

Enough people had enough than now anyone that brings their brand to try to profit off of anything Q gets pretty thoroughly outed. The only reasonable play at this point is for those people who tried to build a brand off of it come clean and run away from that big mistake before more attention comes knocking."
"43","ellwr3g","sfo2","1556056579","Nextdoor Platform Quality","negative","-1.0","Nextdoor is a gold mine, period.  My wife keeps her old nextdoor account active (when we lived in Rockridge) just for the ridiculous shit people post on there.  Some of my favorites:

\- One day, a woman posted that she wanted a broken laundry tub, if anybody had one she could have.  Two days later, she posted again ""free broken laundry tub if anybody wants it.""  WTF happened in those intervening two days?

\- A person consistently tries to give away spoiled food and other trash

\- At least twice a week, a conversation about a random topic devolves into people calling each other racists

&amp;#x200B;

I live up in Montclair now and my nextdoor is hella boring."
"44","ellwsqd","krism142","1556056611","Tax Structure And Public Finance | Housing Supply Expansion","negative | negative","-1.0 | -1.0","If you think this started in 2010 and not back in the 1980's I don't know that we can realistically have this conversation.  Around the 1980's (You know right around the time prop 13 passed...) the bay area pretty much stopped building housing and it has not really started again since then"
"45","ellwtkd","yappary","1556056628","","","","Likely the woman behind the everythingsouthcity.com publication who ran for city council and lost, despite only promoting herself and not giving equal time to her opponents."
"46","ellx0hn","Nederalles","1556056763","","","","&gt; textile 

Man you are too classy for them, I’d have them eat dicks out of a plastic bag."
"47","ellx602","teawar","1556056870","Responsibility Attribution | Homeowner Property Values","negative | negative","-1.0 | -1.0","“The techies just need to fuck off and all will be well.”

There’s still a lingering belief that the current “tech fad” will blow over and the Apple and Facebook employees will all just leave and houses will be 500k again."
"48","ellx7f3","cake_boner","1556056898","Building Height And Density","neutral","0.0","Just a block? That's pretty close in many neighborhoods."
"49","ellx8kd","Nederalles","1556056921","Housing Supply Expansion | Homeowner Property Values","negative | positive","-1.0 | 1.0","&gt; What do they think ""housing crisis"" means??

Too much housing is being built so the price growth acceleration isn’t growing."
"50","ellxarq","user_none","1556056964","Housing Supply Expansion | Building Height And Density | Jobs-Housing Imbalance","negative | neutral | negative","-1.0 | 0.0 | -1.0","You're being down voted and I've brought up the exact type of solution you've proposed and been down voted as well. Everyone wants to add more housing. In case anyone hasn't been paying attention, SF is land locked. Hell, the peninsula is land locked. Most of the Bay Area is land locked. Neighborhoods would have to be razed and built new to support the number of additional housing units needed now, and into the future. Ain't gonna happen.

Stop letting companies build gigantic campuses while also not increasing the number of residential units."
"51","ellxcdz","AncileBooster","1556056996","","","","I've lived in San Jose/Gilroy area most of my life; I understand SF is quite different."
"52","ellxidd","jrhoffa","1556057111","Nextdoor Platform Quality | Neighborhood Character Preservation","negative | negative","-1.0 | -1.0","Airplane noise is literally the worst possible thing in existence, according to my neighbors on Nextdoor."
"53","ellxmfi","bg-j38","1556057189","Parking Availability | Nextdoor Platform Quality","neutral | neutral","0.0 | 0.0","Not trying to side with them, but they do have a limit of four cars registered per address.

https://www.sfmta.com/permits/residential-parking-permits-rpp#RPP_Permanent"
"54","ellxqlr","madalienmonk","1556057270","Neighborhood Character Preservation","positive","1.0","""the feel of our neighborhood"""
"55","ellxs9i","DextroyRawr","1556057303","Nextdoor Platform Quality | Neighborhood Character Preservation | Responsibility Attribution","negative | neutral | neutral","-1.0 | 0.0 | 0.0","Does anyone have good tips to engage in civil discussion?

I try to speak with my neighbors, but it's mostly an echo chamber of complaints. I'm trying to acknowledge their plight and encourage constructive proposals."
"56","ellxvuz","madalienmonk","1556057374","","","","&gt;plastic bag.

That'll be .10 please"
"57","elly14t","BLoSCboy","1556057477","Nextdoor Platform Quality","positive","1.0","I just use Nextdoor for the buy and sell features"
"58","elly3m1","nutationsf","1556057526","Building Height And Density | Transit Proximity | Neighborhood Character Preservation","neutral | neutral | neutral","0.0 | 0.0 | 0.0","Maybe they are referring to the courthouse, jail and massive parking lot, or maybe the probation department.  There is also Colma creek between these developments and any housing as well."
"59","elly7ly","KCrobble","1556057605","","","","That's interesting because it it new.  My kerfluffle with them was about 3 years ago.  Back then, you could apply for additional permits."
"60","elly7wx","icraig91","1556057611","Nextdoor Platform Quality | Racial Coding Of Opposition","negative | neutral","-1.0 | 0.0","Don't you dare call them a Nimby though or all of them just descend on you to attack like fuckin' vultures."
"61","ellyadn","ImFeklhr","1556057662","Nextdoor Platform Quality | Responsibility Attribution","negative | negative","-1.0 | -1.0","Exact same thing happened to me.  Got reported shortly after I negatively commented on someone low-key spamming the site for commercial purposes (self promoting business convention cocktail meet-ups [seemed like a racket]).  They must have reported me in retaliation, as next-door banned me until I emailed them my full name.  I understand their policy on full names it just seems like a  seems like a privacy nightmare."
"62","ellyde9","KCrobble","1556057722","Nextdoor Platform Quality","negative","-1.0","I try to keep it classy. 

I thought it was nuts that they were requiring me to give them my password so they could update my profile themselves.  

When I said I would not do that under any circumstances, the rep replied that ""Well, Nextdoor is not for everyone..."""
"63","ellyj30","night_stocker","1556057836","","","","If only things were so simple that they could be solved with one big solution.

That's the biggest sign that someone doesn't know what the fuck they're talking about. 

**""it's all because of ____!""**

""Yeah sure, everyone's just been putting a lot of effort into multiple complex yet futile solutions""."
"64","ellyjel","icraig91","1556057842","","","","They probably just hate dogs and wanted yours gone. People suck."
